{"concentration":{"skus_for_80pct_revenue":1030,"skus_total":4721,"top_100_share":0.29458294952498426,"top_10_share":0.08043835296758789},"families":[{"customers":5290,"family":"Kitchen and dining","keywords":["MUG","\\bCUP","TEAPOT","TEA SET","TEASET","PLATE","BOWL","CAKE","BAKING","CUTLERY","SPOON","\\bJAR\\b","\\bTIN\\b","BOTTLE"],"revenue_gbp":4737776.55,"share":0.2411904606930083,"skus":780,"units":2108169},{"customers":5008,"family":"Home decor","keywords":["HEART","FRAME","SIGN","WALL","CLOCK","CUSHION","DOORMAT","HOOK","VASE","HANGING","DECORATION","ORNAMENT","GARLAND","BUNTING"],"revenue_gbp":3249957.69,"share":0.1654486623021287,"skus":697,"units":1514155},{"customers":5006,"family":"Paper cards and wrap","keywords":["CARD","WRAP","PAPER","NOTEBOOK","STICKER","RIBBON","GIFT TAG","TAG","ENVELOPE","PENCIL","\\bPEN\\b","ALBUM","\\bBOOK","STATIONERY"],"revenue_gbp":2338939.56,"share":0.11907060285684164,"skus":681,"units":2150917},{"customers":3963,"family":"Bags and purses","keywords":["\\bBAG\\b","\\bBAGS\\b","TOTE","SHOPPER","PURSE","WALLET","BACKPACK","SATCHEL","LUNCH BAG","WASHBAG","POUCH"],"revenue_gbp":2028722.01,"share":0.10327806536379175,"skus":203,"units":1197231},{"customers":4419,"family":"Storage and boxes","keywords":["\\bBOX\\b","\\bBOXES\\b","BASKET","CRATE","DRAWER","CABINET","STORAGE","TRUNK","CHEST","ORGANI","CASE","RACK","TIDY","SHELF"],"revenue_gbp":1355700.04,"share":0.0690159009734482,"skus":218,"units":616812},{"customers":4235,"family":"Candles and fragrance","keywords":["CANDLE","T-LIGHT","TLIGHT","TEA LIGHT","TEALIGHT","LANTERN","INCENSE","FRAGRANCE","OIL BURNER","POTPOURRI","SCENT"],"revenue_gbp":1289186.42,"share":0.06562982936773698,"skus":435,"units":897060},{"customers":3772,"family":"Seasonal and festive","keywords":["CHRISTMAS","XMAS","SANTA","REINDEER","ADVENT","SNOWMAN","SNOWFLAKE","EASTER","HALLOWEEN","PUMPKIN","TINSEL","NATIVITY","ELF\\b","ANGEL"],"revenue_gbp":1085311.68,"share":0.055250985632637556,"skus":313,"units":683295},{"customers":4011,"family":"Toys games and party","keywords":["TOY","GAME","DOLL","PUZZLE","PARTY","BALLOON","CHILDREN","KIDS","\\bPLAY","SPACEBOY","DOLLY","BIRTHDAY","CRAFT","MONEY BOX"],"revenue_gbp":933884.03,"share":0.0475421153894519,"skus":148,"units":476546},{"customers":4210,"family":"Other","keywords":[],"revenue_gbp":815754.32,"share":0.04152837479283579,"skus":338,"units":581218},{"customers":3285,"family":"Lighting","keywords":["LIGHT","LAMP","BULB","LAMPSHADE","CHANDELIER","FAIRY"],"revenue_gbp":625330.71,"share":0.031834300423135,"skus":135,"units":347873},{"customers":3306,"family":"Garden and outdoor","keywords":["GARDEN","PLANT","WATERING","FEEDER","HERB","SEED","\\bPOT\\b","OUTDOOR","WINDMILL","PARASOL","BIRDHOUSE","BIRD HOUSE","HAMMOCK","SPADE"],"revenue_gbp":554591.5,"share":0.02823311272065463,"skus":132,"units":213331},{"customers":3017,"family":"Jewellery and accessories","keywords":["NECKLACE","BRACELET","EARRING","\\bRING\\b","BEAD","PENDANT","CHARM","BROOCH","ANKLET","JEWEL","BANGLE","HAIRCLIP","HAIR","SCARF"],"revenue_gbp":321296.43,"share":0.01635654048959277,"skus":521,"units":256661},{"customers":2588,"family":"Bath and personal care","keywords":["SOAP","BATH","TOWEL","SPONGE","HOT WATER","SHOWER","TOOTHBRUSH","MIRROR","COMB","BRUSH","COSMETIC","WASH","SLIPPER","UMBRELLA"],"revenue_gbp":306848.95,"share":0.01562104899473676,"skus":120,"units":144602}],"family_coverage_revenue_share":0.9584716252071642,"family_coverage_sku_share":0.9284049989409023,"family_rule":"First matching regular expression of seeds/product_family_rules.csv on the upper-cased SKU description (priority order). Unmatched products are 'Other'. DERIVED: the source has no category column.","schema_version":"v1","tags":{"concentration":"OBSERVED","families":"DERIVED","top_skus":"OBSERVED"},"top_skus":[{"customers":1314,"description":"Regency Cakestand 3 Tier","family":"Kitchen and dining","first_week":"2010-03-15","invoices":3918,"last_week":"2011-12-05","median_price_gbp":12.75,"refund_units":1450,"revenue_gbp":330590.32,"sku":"22423","units":26478},{"customers":1490,"description":"White Hanging Heart T-Light Holder","family":"Candles and fragrance","first_week":"2009-11-30","invoices":5464,"last_week":"2011-12-05","median_price_gbp":2.95,"refund_units":3637,"revenue_gbp":261168.73,"sku":"85123A","units":94719},{"customers":978,"description":"Jumbo Bag Red Retrospot","family":"Bags and purses","first_week":"2009-11-30","invoices":4013,"last_week":"2011-12-05","median_price_gbp":1.95,"refund_units":1213,"revenue_gbp":182680.98,"sku":"85099B","units":97176},{"customers":1,"description":"Paper Craft , Little Birdie","family":"Paper cards and wrap","first_week":"2011-12-05","invoices":1,"last_week":"2011-12-05","median_price_gbp":2.08,"refund_units":80995,"revenue_gbp":168469.6,"sku":"23843","units":80995},{"customers":894,"description":"Party Bunting","family":"Toys games and party","first_week":"2009-11-30","invoices":2674,"last_week":"2011-12-05","median_price_gbp":4.95,"refund_units":285,"revenue_gbp":148318.28,"sku":"47566","units":28200},{"customers":1010,"description":"Assorted Colour Bird Ornament","family":"Home decor","first_week":"2009-11-30","invoices":2807,"last_week":"2011-12-05","median_price_gbp":1.69,"refund_units":511,"revenue_gbp":129324.49,"sku":"84879","units":80082},{"customers":896,"description":"Paper Chain Kit 50'S Christmas","family":"Seasonal and festive","first_week":"2009-11-30","invoices":2018,"last_week":"2011-12-05","median_price_gbp":2.95,"refund_units":590,"revenue_gbp":117760.29,"sku":"22086","units":35084},{"customers":138,"description":"Medium Ceramic Top Storage Jar","family":"Kitchen and dining","first_week":"2011-01-17","invoices":247,"last_week":"2011-12-05","median_price_gbp":1.25,"refund_units":74494,"revenue_gbp":81700.92,"sku":"23166","units":78033},{"customers":304,"description":"Chilli Lights","family":"Lighting","first_week":"2009-11-30","invoices":1135,"last_week":"2011-12-05","median_price_gbp":4.95,"refund_units":145,"revenue_gbp":80540.88,"sku":"79321","units":15841},{"customers":601,"description":"Small Popcorn Holder","family":"Storage and boxes","first_week":"2009-11-30","invoices":2322,"last_week":"2011-12-05","median_price_gbp":0.85,"refund_units":804,"revenue_gbp":79520.2,"sku":"22197","units":88499},{"customers":601,"description":"Jumbo Bag Pink Polkadot","family":"Bags and purses","first_week":"2010-01-25","invoices":2245,"last_week":"2011-12-05","median_price_gbp":1.95,"refund_units":482,"revenue_gbp":76324.62,"sku":"22386","units":39437},{"customers":300,"description":"Rotating Silver Angels T-Light Hldr","family":"Seasonal and festive","first_week":"2009-11-30","invoices":756,"last_week":"2011-12-05","median_price_gbp":2.55,"refund_units":9381,"revenue_gbp":71300.4,"sku":"84347","units":31409},{"customers":845,"description":"Lunch Bag Red Retrospot","family":"Bags and purses","first_week":"2009-11-30","invoices":3056,"last_week":"2011-12-05","median_price_gbp":1.65,"refund_units":931,"revenue_gbp":71106.29,"sku":"20725","units":40317},{"customers":549,"description":"Jumbo Bag Strawberry","family":"Bags and purses","first_week":"2009-11-30","invoices":1855,"last_week":"2011-12-05","median_price_gbp":1.95,"refund_units":283,"revenue_gbp":69002.13,"sku":"85099F","units":37061},{"customers":678,"description":"Doormat Union Flag","family":"Home decor","first_week":"2009-12-14","invoices":1664,"last_week":"2011-12-05","median_price_gbp":7.49,"refund_units":51,"revenue_gbp":67010.31,"sku":"48138","units":10077},{"customers":450,"description":"Rabbit Night Light","family":"Lighting","first_week":"2011-05-09","invoices":994,"last_week":"2011-12-05","median_price_gbp":2.08,"refund_units":108,"revenue_gbp":66870.03,"sku":"23084","units":30739},{"customers":626,"description":"Doormat Red Retrospot","family":"Home decor","first_week":"2009-11-30","invoices":1725,"last_week":"2011-12-05","median_price_gbp":7.49,"refund_units":91,"revenue_gbp":66417.47,"sku":"20685","units":9783},{"customers":198,"description":"Black Record Cover Frame","family":"Home decor","first_week":"2009-11-30","invoices":634,"last_week":"2011-12-05","median_price_gbp":3.75,"refund_units":23,"revenue_gbp":65189.29,"sku":"21137","units":18739},{"customers":599,"description":"Red Retrospot Cake Stand","family":"Kitchen and dining","first_week":"2009-11-30","invoices":1527,"last_week":"2011-12-05","median_price_gbp":10.95,"refund_units":587,"revenue_gbp":64918.3,"sku":"21843","units":6128},{"customers":546,"description":"Jumbo Storage Bag Suki","family":"Bags and purses","first_week":"2009-11-30","invoices":2329,"last_week":"2011-12-05","median_price_gbp":1.95,"refund_units":390,"revenue_gbp":61537.55,"sku":"21931","units":29182},{"customers":335,"description":"Picnic Basket Wicker Small","family":"Kitchen and dining","first_week":"2010-05-17","invoices":924,"last_week":"2011-09-19","median_price_gbp":5.95,"refund_units":86,"revenue_gbp":60880.3,"sku":"22502","units":3766},{"customers":583,"description":"Vintage Union Jack Bunting","family":"Paper cards and wrap","first_week":"2009-11-30","invoices":1292,"last_week":"2011-12-05","median_price_gbp":8.5,"refund_units":64,"revenue_gbp":60286.04,"sku":"21621","units":6900},{"customers":347,"description":"Edwardian Parasol Natural","family":"Garden and outdoor","first_week":"2009-11-30","invoices":1149,"last_week":"2011-12-05","median_price_gbp":5.95,"refund_units":155,"revenue_gbp":60145.85,"sku":"15056N","units":11459},{"customers":626,"description":"Hot Water Bottle Tea And Sympathy","family":"Kitchen and dining","first_week":"2009-11-30","invoices":1583,"last_week":"2011-12-05","median_price_gbp":3.95,"refund_units":220,"revenue_gbp":59189.14,"sku":"22114","units":11677},{"customers":506,"description":"Jumbo  Bag Baroque Black White","family":"Bags and purses","first_week":"2009-11-30","invoices":1878,"last_week":"2011-12-05","median_price_gbp":1.95,"refund_units":313,"revenue_gbp":59